{"$id": "https://spectrcyde.com/scythe/mechanics/schema/mechanical_state.v1.json", "$schema": "http://json-schema.org/draft-07/schema#", "additionalProperties": false, "description": "Interchange contract for physics-derived receiver mechanical state. Produced by importers/ from solver exports (CSV/VTK). Consumed by SCYTHE's RF inference stack as an optional explanatory hypothesis, never as measurement.", "properties": {"provenance": {"additionalProperties": false, "properties": {"boundary_condition_digest": {"description": "SHA-256 over the boundary-condition / loading block.", "pattern": "^[0-9a-f]{64}$", "type": "string"}, "deck_sha256": {"description": "SHA-256 of the solver input deck (.rad / .k) that produced this record.", "pattern": "^[0-9a-f]{64}$", "type": "string"}, "export_digest": {"description": "SHA-256 of the raw solver export file (CSV/VTK) this record was derived from.", "pattern": "^[0-9a-f]{64}$", "type": "string"}, "exported_at": {"description": "When the export was produced (ISO 8601).", "format": "date-time", "type": "string"}, "material_model_digest": {"description": "SHA-256 over the material cards / material parameter block.", "pattern": "^[0-9a-f]{64}$", "type": "string"}, "mesh_sha256": {"description": "SHA-256 of the mesh file, if external to the deck.", "pattern": "^[0-9a-f]{64}$", "type": "string"}, "solver_build": {"description": "Release identifier of the solver binary used.", "type": "string"}, "solver_commit": {"description": "Full commit SHA of the solver source. Redundant with solver.commit by design: provenance must survive even if the solver block is stripped.", "pattern": "^[0-9a-f]{40}$", "type": "string"}}, "required": ["deck_sha256", "mesh_sha256", "material_model_digest", "boundary_condition_digest", "solver_commit", "export_digest"], "type": "object"}, "receiver": {"additionalProperties": false, "properties": {"acceleration_mps2": {"description": "Phase-center acceleration [ax, ay, az] in m/s^2.", "items": {"type": "number"}, "maxItems": 3, "minItems": 3, "type": "array"}, "antenna_normal": {"description": "Antenna boresight unit vector. SHOULD be unit length; importers normalize.", "items": {"type": "number"}, "maxItems": 3, "minItems": 3, "type": "array"}, "enclosure_vibration_mps2": {"description": "Enclosure acceleration [ax, ay, az] in m/s^2 \u2014 the quantity an accelerometer would corroborate.", "items": {"type": "number"}, "maxItems": 3, "minItems": 3, "type": "array"}, "mount_flex_m": {"description": "Mount-point flex displacement [x, y, z] in metres, if the deck models the mount.", "items": {"type": "number"}, "maxItems": 3, "minItems": 3, "type": "array"}, "phase_center_displacement_m": {"description": "Displacement of the phase center from its nominal (undeformed) position.", "items": {"type": "number"}, "maxItems": 3, "minItems": 3, "type": "array"}, "phase_center_m": {"description": "Antenna phase-center position [x, y, z] in metres, simulation frame.", "items": {"type": "number"}, "maxItems": 3, "minItems": 3, "type": "array"}, "uncertainty": {"additionalProperties": false, "description": "1-sigma uncertainties on the above, same units. Simulation uncertainty is model-form + discretization, not sensor noise.", "properties": {"acceleration_mps2": {"minimum": 0, "type": "number"}, "antenna_normal_rad": {"minimum": 0, "type": "number"}, "phase_center_m": {"minimum": 0, "type": "number"}, "velocity_mps": {"minimum": 0, "type": "number"}}, "type": "object"}, "velocity_mps": {"description": "Phase-center velocity [vx, vy, vz] in m/s. Feeds the f_d = v_r / lambda discriminator.", "items": {"type": "number"}, "maxItems": 3, "minItems": 3, "type": "array"}}, "required": ["phase_center_m", "velocity_mps", "acceleration_mps2", "antenna_normal"], "type": "object"}, "schema": {"const": "scythe.mechanical-state.v1", "description": "Schema identifier. Importers must stamp exactly this.", "type": "string"}, "simulation_time_s": {"description": "Solver time at which this state snapshot was sampled.", "minimum": 0, "type": "number"}, "solver": {"additionalProperties": false, "properties": {"build": {"description": "Release/build identifier, e.g. 'OpenCourant_linux64.zip @ latest-20261006'. Informational; the commit SHA is the pin.", "type": "string"}, "commit": {"description": "Full commit SHA of the solver source. Tags may move; SHAs do not.", "pattern": "^[0-9a-f]{40}$", "type": "string"}, "name": {"description": "Solver instrument, e.g. 'OpenCourant' (community fork of OpenRadioss). Schema is solver-agnostic; modal solvers (CalculiX, Code_Aster) are legal here too.", "type": "string"}}, "required": ["name", "commit"], "type": "object"}, "state_class": {"const": "SIMULATED_MECHANICAL_STATE", "description": "LOAD-BEARING. This record is a physics-derived hypothesis from a solver. It is NEVER a measurement. The only other legal value in SCYTHE's state taxonomy is MEASURED_RECEIVER_STATE (instruments: GPS/IMU/accelerometer), which this schema MUST NOT emit.", "type": "string"}}, "required": ["schema", "state_class", "solver", "simulation_time_s", "receiver", "provenance"], "title": "SCYTHE Mechanical State v1", "type": "object"}