{"provenance":{"boundary_condition_digest":"e3b0c44298fc1c149afbf4c8996fb92427ae41e4649b934ca495991b7852b855","deck_sha256":"e3b0c44298fc1c149afbf4c8996fb92427ae41e4649b934ca495991b7852b855","export_digest":"e3b0c44298fc1c149afbf4c8996fb92427ae41e4649b934ca495991b7852b855","exported_at":"2026-10-05T19:00:00Z","material_model_digest":"e3b0c44298fc1c149afbf4c8996fb92427ae41e4649b934ca495991b7852b855","mesh_sha256":"e3b0c44298fc1c149afbf4c8996fb92427ae41e4649b934ca495991b7852b855","solver_build":"OpenCourant_linux64.zip @ latest-20261006","solver_commit":"33e685176cccf0c539a3ce07aa2096985a284e2a"},"receiver":{"acceleration_mps2":[0.14,-0.08,0.42],"antenna_normal":[0.017,0.043,0.99893],"enclosure_vibration_mps2":[0.11,-0.06,0.38],"mount_flex_m":[0.00021,-0.00005,0.00002],"phase_center_displacement_m":[0.00142,-0.00031,0.0001],"phase_center_m":[0.00142,-0.00031,1.6821],"uncertainty":{"acceleration_mps2":0.02,"antenna_normal_rad":0.005,"phase_center_m":0.0002,"velocity_mps":0.001},"velocity_mps":[0.0041,-0.0022,0.0138]},"schema":"scythe.mechanical-state.v1","simulation_time_s":0.734,"solver":{"build":"OpenCourant_linux64.zip @ latest-20261006","commit":"33e685176cccf0c539a3ce07aa2096985a284e2a","name":"OpenCourant"},"state_class":"SIMULATED_MECHANICAL_STATE"}